{
  "schema_version": 1,
  "model_id": "DynamicResidencyR10",
  "status": "draft",
  "requirement": "RESIDENCY-DYN-001",
  "predecessor": {
    "analysis": "Analysis-0209",
    "validation": "Validation-0296",
    "reviewed_sha256": "f7e9f3df695af3015681da99a48bffcc44fe916588da66230fff82be5b411362"
  },
  "claim_boundary": {
    "claims": [
      "R10-DRAFT-IR-STRUCTURE-EXISTS",
      "R10-DRAFT-AUTHORITY-TRANSFER-SLICE-ENCODED"
    ],
    "nonclaims": [
      "R10-ARCHITECTURE-FROZEN",
      "R10-DYNAMIC-RESIDENCY-CLOSED",
      "R10-TLA-AUTHORIZED",
      "MODEL-SUPPORTED",
      "PHYSICAL-ISOLATION-EVIDENCED",
      "HYPERVISOR-LEVEL-PROTECTION-EVIDENCED",
      "LINUX-REFINEMENT-EVIDENCED",
      "MULTI-CLUSTER-CORRECTNESS-EVIDENCED",
      "PERFORMANCE-OR-COST-EFFICIENCY-EVIDENCED",
      "DEPLOYMENT-READY"
    ]
  },
  "bounds": {
    "MaxGeneration": 4,
    "MaxTxnLocations": 12,
    "MaxProjectionCursor": 4,
    "MaxDelegationDepth": 2,
    "InitialAuthorityUses": 2,
    "ObjectSlotCapacity": 16,
    "MaxInstanceCandidates": 1024
  },
  "types": [
    {"id": "Bool", "kind": "builtin", "builtin": "Bool"},
    {"id": "Int", "kind": "builtin", "builtin": "Int"},
    {"id": "String", "kind": "builtin", "builtin": "String"},
    {"id": "NodeID", "kind": "nominal", "values": ["N0", "N1"]},
    {"id": "ShardID", "kind": "nominal", "values": ["S0", "S1"]},
    {"id": "TxnSlotID", "kind": "nominal", "values": ["TS0", "TS1", "TS2", "TS3", "TS4", "TS5", "TS6", "TS7", "TS8", "TS9", "TS10", "TS11"]},
    {"id": "TxnID", "kind": "nominal", "values": ["TX0", "TX1", "TX2", "TX3", "TX4", "TX5", "TX6", "TX7", "TX8", "TX9", "TX10", "TX11"]},
    {"id": "OutcomeID", "kind": "nominal", "values": ["OUT0", "OUT1", "OUT2", "OUT3", "OUT4", "OUT5", "OUT6", "OUT7", "OUT8", "OUT9", "OUT10", "OUT11"]},
    {"id": "TombstoneID", "kind": "nominal", "values": ["TOMB0", "TOMB1", "TOMB2", "TOMB3", "TOMB4", "TOMB5", "TOMB6", "TOMB7", "TOMB8", "TOMB9", "TOMB10", "TOMB11"]},
    {"id": "ObjectSlotID", "kind": "nominal", "values": ["OBJ0", "OBJ1", "OBJ2", "OBJ3", "OBJ4", "OBJ5", "OBJ6", "OBJ7", "OBJ8", "OBJ9", "OBJ10", "OBJ11", "OBJ12", "OBJ13", "OBJ14", "OBJ15"]},
    {"id": "AuthorityID", "kind": "nominal", "values": ["AUTH0", "AUTH1", "AUTH2"]},
    {"id": "RevScopeID", "kind": "nominal", "values": ["REV0", "REV1", "REV2"]},
    {"id": "SubjectID", "kind": "nominal", "values": ["MGMT", "DOM0", "DOM1"]},
    {"id": "CpuID", "kind": "nominal", "values": ["CPU0", "CPU1"]},
    {"id": "ProgramID", "kind": "nominal", "values": ["PROG0", "PROG1"]},
    {"id": "ProtectionDomainID", "kind": "nominal", "values": ["PD-MGMT", "PD0", "PD1"]},
    {"id": "CarrierID", "kind": "nominal", "values": ["CAR0", "CAR1"]},
    {"id": "AdmissionID", "kind": "nominal", "values": ["ADM0", "ADM1"]},
    {"id": "AggregateID", "kind": "nominal", "values": ["AGG0", "AGG1"]},
    {"id": "StreamID", "kind": "nominal", "values": ["STR0", "STR1"]},
    {"id": "OpportunityID", "kind": "nominal", "values": ["OPP0", "OPP1"]},
    {"id": "AttemptID", "kind": "nominal", "values": ["ATT0", "ATT1"]},
    {"id": "ReadyID", "kind": "nominal", "values": ["READY0", "READY1"]},
    {"id": "RootFrameID", "kind": "nominal", "values": ["FRAME0", "FRAME1"]},
    {"id": "RootSlotID", "kind": "nominal", "values": ["RSLOT0", "RSLOT1"]},
    {"id": "EscrowID", "kind": "nominal", "values": ["ESC0", "ESC1"]},
    {"id": "EntryBindingID", "kind": "nominal", "values": ["ENTRY0", "ENTRY1"]},
    {"id": "StopID", "kind": "nominal", "values": ["STOP0", "STOP1"]},
    {"id": "SettlementID", "kind": "nominal", "values": ["SETTLE0", "SETTLE1"]},
    {"id": "QuantumID", "kind": "nominal", "values": ["QUANT0", "QUANT1"]},
    {"id": "ReceiptID", "kind": "nominal", "values": ["RECEIPT0", "RECEIPT1", "RECEIPT2"]},
    {"id": "ContextID", "kind": "nominal", "values": ["CTX0", "CTX1"]},
    {"id": "PartitionReceiptID", "kind": "nominal", "values": ["PART0", "PART1"]},
    {"id": "GrantID", "kind": "nominal", "values": ["GRANT0", "GRANT1"]},
    {"id": "DecisionTag", "kind": "enum", "values": ["Commit", "Abort"]},
    {"id": "AbortReason", "kind": "enum", "values": ["CrashBeforeDecision", "VersionMismatch", "GuardFalse", "Cancelled", "Expired"]},
    {"id": "AuthorityKind", "kind": "enum", "values": ["Run", "Spawn", "Async", "Sched", "Charge"]},
    {"id": "ActivationSourceKind", "kind": "enum", "values": ["Sync", "Async"]},
    {"id": "SubjectKind", "kind": "enum", "values": ["Management", "Process", "Thread", "Service"]},
    {"id": "ApplyBit", "kind": "enum", "values": ["NotApplicable", "Pending", "Applied"]},
    {"id": "ChargeMode", "kind": "enum", "values": ["ExecutionOnly", "ExecutionAndOverhead", "ServiceOnly"]},
    {"id": "ShardKey", "kind": "tuple", "members": ["NodeID", "ShardID"]},
    {
      "id": "ResourceVector",
      "kind": "record",
      "fields": [
        {"name": "uses", "type": "Int"},
        {"name": "sched_ticks", "type": "Int"},
        {"name": "root_ticks", "type": "Int"},
        {"name": "charge_ticks", "type": "Int"},
        {"name": "stop_credits", "type": "Int"},
        {"name": "execution_cells", "type": "Int"}
      ]
    },
    {
      "id": "AuthorityConstraints",
      "kind": "record",
      "fields": [
        {"name": "operation_mask", "type": "Int"},
        {"name": "cpu_mask", "type": "Int"},
        {"name": "priority_ceiling", "type": "Int"},
        {"name": "co_tenancy_class", "type": "Int"},
        {"name": "horizon_end", "type": "Int"},
        {"name": "delegation_depth", "type": "Int"}
      ]
    },
    {
      "id": "RevScopeRef",
      "kind": "record",
      "fields": [
        {"name": "active", "type": "Bool"},
        {"name": "scope", "type": "RevScopeID"},
        {"name": "generation", "type": "Int"}
      ]
    },
    {"id": "RevocationPath", "kind": "vector", "element_type": "RevScopeRef", "length_ast": ["bound", "MaxDelegationDepth"]},
    {
      "id": "TxnPlan",
      "kind": "record",
      "fields": [
        {"name": "plan_slot", "type": "ObjectSlotID"},
        {"name": "expected_digest", "type": "String"}
      ]
    },
    {
      "id": "AuthorityCore",
      "kind": "record",
      "fields": [
        {"name": "id", "type": "AuthorityID"},
        {"name": "parent", "type": "AuthorityID"},
        {"name": "owner", "type": "SubjectID"},
        {"name": "kind", "type": "AuthorityKind"},
        {"name": "grant", "type": "ResourceVector"},
        {"name": "constraints", "type": "AuthorityConstraints"},
        {"name": "revocation_path", "type": "RevocationPath"},
        {"name": "own_scope", "type": "RevScopeID"},
        {"name": "issue_ordinal", "type": "Int"}
      ]
    },
    {
      "id": "AuthorityIntersectionCore",
      "kind": "record",
      "fields": [
        {"name": "caller_authority", "type": "AuthorityID"},
        {"name": "service_authority", "type": "AuthorityID"},
        {"name": "effective_constraints", "type": "AuthorityConstraints"},
        {"name": "caller_use_ordinal", "type": "Int"},
        {"name": "service_use_ordinal", "type": "Int"},
        {"name": "caller_escrow", "type": "EscrowID"},
        {"name": "service_escrow", "type": "EscrowID"}
      ]
    },
    {
      "id": "ActivationRequestCore",
      "kind": "record",
      "fields": [
        {"name": "id", "type": "ObjectSlotID"},
        {"name": "source_kind", "type": "ActivationSourceKind"},
        {"name": "carrier", "type": "CarrierID"},
        {"name": "execution_subject", "type": "SubjectID"},
        {"name": "program", "type": "ProgramID"},
        {"name": "protection_domain", "type": "ProtectionDomainID"},
        {"name": "run_authority", "type": "AuthorityID"},
        {"name": "sched_authority", "type": "AuthorityID"},
        {"name": "charge_authority", "type": "AuthorityID"},
        {"name": "constraints", "type": "AuthorityConstraints"},
        {"name": "requested_service", "type": "Int"},
        {"name": "horizon_end", "type": "Int"}
      ]
    },
    {
      "id": "DispatchAuthoritySnapshot",
      "kind": "record",
      "fields": [
        {"name": "id", "type": "ObjectSlotID"},
        {"name": "opportunity", "type": "OpportunityID"},
        {"name": "attempt", "type": "AttemptID"},
        {"name": "ready", "type": "ReadyID"},
        {"name": "activation_request", "type": "ObjectSlotID"},
        {"name": "subject", "type": "SubjectID"},
        {"name": "subject_generation", "type": "Int"},
        {"name": "program", "type": "ProgramID"},
        {"name": "program_generation", "type": "Int"},
        {"name": "aggregate", "type": "AggregateID"},
        {"name": "aggregate_generation", "type": "Int"},
        {"name": "run_authority", "type": "AuthorityID"},
        {"name": "run_generation", "type": "Int"},
        {"name": "sched_authority", "type": "AuthorityID"},
        {"name": "charge_authority", "type": "AuthorityID"},
        {"name": "escrow", "type": "EscrowID"},
        {"name": "context", "type": "ContextID"},
        {"name": "target_cpu", "type": "CpuID"},
        {"name": "cpu_incarnation", "type": "Int"},
        {"name": "revocation_path", "type": "RevocationPath"},
        {"name": "horizon_end", "type": "Int"}
      ]
    },
    {
      "id": "EligibilitySealCore",
      "kind": "record",
      "fields": [
        {"name": "id", "type": "ObjectSlotID"},
        {"name": "snapshot", "type": "ObjectSlotID"},
        {"name": "context_receipt", "type": "ReceiptID"},
        {"name": "eligibility_generation", "type": "Int"},
        {"name": "not_after", "type": "Int"}
      ]
    },
    {
      "id": "PhysicalEntryBindingCore",
      "kind": "record",
      "fields": [
        {"name": "id", "type": "EntryBindingID"},
        {"name": "eligibility_seal", "type": "ObjectSlotID"},
        {"name": "root_frame", "type": "RootFrameID"},
        {"name": "root_slot", "type": "RootSlotID"},
        {"name": "ready", "type": "ReadyID"},
        {"name": "attempt", "type": "AttemptID"},